{
  "@context": [
    "https://www.w3.org/ns/credentials/v2",
    "https://purl.imsglobal.org/spec/ob/v3p0/context-3.0.3.json"
  ],
  "id": "urn:uuid:7f3b8c2a-9e1d-4f6b-8a2c-1d3e5f7a9b0c",
  "type": [
    "VerifiableCredential",
    "OpenBadgeCredential"
  ],
  "issuer": {
    "id": "https://credentials.youvaed.ai/issuers/youva-platform",
    "name": "YOUVA EdAI Platform & Delhi Public School Pilot",
    "url": "https://credentials.youvaed.ai"
  },
  "validFrom": "2026-09-01T10:00:00Z",
  "credentialSubject": {
    "id": "urn:youva:student:e3b0c44298fc1c149afbf4c8996fb92427ae41e4649b934ca495991b7852b855",
    "achievement": {
      "name": "Mastery in Linear Equations in One Variable (Grade 8)",
      "description": "Demonstrated full concept mastery and independent problem-solving in linear equation modeling.",
      "criteria": "Achieved >= 0.85 mastery score across 25 validated practice items with < 20% hint utilization.",
      "competencyCode": "MATH-G8-ALG-01",
      "masteryScore": 0.92
    },
    "evidence": [
      {
        "id": "urn:youva:evidence:session-8910-batch-4",
        "type": "FormativeAssessmentTrace",
        "description": "Independent adaptive problem set verified with Bayesian Knowledge Tracing.",
        "metrics": {
          "questionsAnswered": 25,
          "independentAccuracy": 0.88,
          "timeOnTaskMinutes": 52.5
        }
      }
    ],
    "verificationTokenHash": "ba7816bf8f01cfea414140de5dae2223b00361a396177a9cb410ff61f20015ad"
  },
  "proof": {
    "type": "Ed25519Signature2020",
    "created": "2026-09-01T10:05:00Z",
    "verificationMethod": "https://credentials.youvaed.ai/keys/platform-ed25519-key-1",
    "proofPurpose": "assertionMethod",
    "proofValue": "z3h8g74j9fkldsf879342kjhsd987234hjkfd789234jhksdf789234jhksdf789234"
  },
  "teacherAuthorization": {
    "teacherId": "tch_delhi_math_042",
    "teacherName": "Pooja Verma, TGT Mathematics",
    "authorizationTimestamp": "2026-09-01T10:04:30Z",
    "signature": "c4ca4238a0b923820dcc509a6f75849b2827df61a9796013a7c66a87756f6c91a0b923820dcc509a6f75849b2827df61a9796013a7c66a87756f6c91a0b92382",
    "decision": "APPROVED"
  }
}
